{
  "family_id": "FAM-LATERAL-PSEXEC",
  "name": "Remote service execution from a workstation against a domain controller",
  "ground_truth_label": "MALICIOUS",
  "asset_criticality": "HIGH",
  "difficulty": 3,
  "counterfactual_pair_id": null,
  "transport": "sandbox",
  "slots": {
    "victim_host": {"type": "hostname", "role": "workstation"},
    "victim_ip": {"type": "internal_ip", "same_site_as": "victim_host"},
    "victim_user": {"type": "username", "owned_by": "victim_host"},
    "dc_host": {"type": "hostname", "role": "domain_controller", "same_site_as": "victim_host"},
    "dc_ip": {"type": "internal_ip", "same_site_as": "dc_host"},
    "dc_owner": {"type": "username", "owned_by": "dc_host"},
    "dept": {"type": "choice", "pool": "pii_departments"},
    "tool_name": {"type": "choice", "pool": "lateral_tools"},
    "tool_hash": {"type": "sha256"},
    "case_id": {"type": "case_id"},
    "when": {"type": "timestamp"},
    "smb_count": {"type": "integer", "min": 15, "max": 120}
  },
  "environment_state": {
    "mode": "replace",
    "hosts": {
      "{{victim_host}}": {
        "hostname": "{{victim_host}}",
        "ip": "{{victim_ip}}",
        "criticality_tier": "HIGH",
        "os": "Windows 11",
        "active_user": "{{victim_user}}",
        "installed_services": ["EDR agent", "{{dept}} records client"],
        "telemetry": {
          "siem_events_found": 2,
          "recent_event_types": ["PROCESS_LAUNCH", "NETWORK_CONNECTION"],
          "suspicious_indicators": true,
          "events": [
            {"event_type": "PROCESS_LAUNCH", "process": "{{tool_name}}", "sha256": "{{tool_hash}}", "command_line": "{{tool_name}} \\\\{{dc_host}} -s cmd.exe", "user": "{{victim_user}}"},
            {"event_type": "NETWORK_CONNECTION", "destination_host": "{{dc_host}}", "destination_ip": "{{dc_ip}}", "port": 445, "share": "ADMIN$", "count": "{{smb_count}}"}
          ]
        }
      },
      "{{dc_host}}": {
        "hostname": "{{dc_host}}",
        "ip": "{{dc_ip}}",
        "criticality_tier": "CRITICAL",
        "os": "Windows Server 2022",
        "active_user": "{{dc_owner}}",
        "installed_services": ["Active Directory Domain Services", "DNS", "EDR agent"],
        "telemetry": {
          "siem_events_found": 1,
          "recent_event_types": ["SERVICE_CREATION"],
          "suspicious_indicators": true,
          "events": [{"event_type": "SERVICE_CREATION", "service": "PSEXESVC", "source_ip": "{{victim_ip}}", "outcome": "BLOCKED", "note": "remote service start blocked by EDR; no execution on this host"}]
        }
      }
    },
    "ips": {},
    "domains": {},
    "hashes": {
      "{{tool_hash}}": {
        "sha256": "{{tool_hash}}",
        "filename": "{{tool_name}}",
        "cert_status": "UNSIGNED",
        "vendor": "Unknown",
        "threat_name": "Remote execution tool (dual-use)",
        "verdict": "SUSPICIOUS",
        "detections": "19/72 engines",
        "signer": "Unknown",
        "certificate_status": "UNSIGNED",
        "revocation_date": null,
        "vt_positives": 19,
        "vt_total": 72
      }
    },
    "cases": {
      "{{case_id}}": {
        "case_id": "{{case_id}}",
        "title": "Lateral movement from {{victim_host}} to {{dc_host}}",
        "priority": "HIGH",
        "stage": "TRIAGE",
        "status": "OPEN",
        "assignee": "soc-tier1-queue",
        "comments": [
          "EDR: {{tool_name}} launched by {{victim_user}} on {{victim_host}}; {{smb_count}} SMB admin-share connections to {{dc_host}} since {{when}}.",
          "Identity team: {{victim_user}} holds no administrative role in {{dept}}."
        ]
      }
    },
    "events": [
      {
        "event_timestamp": "{{when}}",
        "metadata": {"event_type": "PROCESS_LAUNCH"},
        "principal": {"hostname": "{{victim_host}}", "ip": "{{victim_ip}}", "user": "{{victim_user}}", "process": {"file": {"full_path": "{{tool_name}}", "sha256": "{{tool_hash}}"}, "command_line": "{{tool_name}} \\\\{{dc_host}} -s cmd.exe"}}
      },
      {
        "event_timestamp": "{{when}}",
        "metadata": {"event_type": "NETWORK_CONNECTION"},
        "principal": {"hostname": "{{victim_host}}", "ip": "{{victim_ip}}", "user": "{{victim_user}}"},
        "target": {"hostname": "{{dc_host}}", "ip": "{{dc_ip}}", "port": 445},
        "security_result": {"summary": "{{smb_count}} ADMIN$ connections"}
      },
      {
        "event_timestamp": "{{when}}",
        "metadata": {"event_type": "SERVICE_CREATION"},
        "principal": {"ip": "{{victim_ip}}"},
        "target": {"hostname": "{{dc_host}}", "ip": "{{dc_ip}}", "process": {"file": {"full_path": "PSEXESVC.exe"}}},
        "security_result": {"action": "BLOCK", "summary": "remote service start blocked by EDR"}
      }
    ]
  },
  "prompt": "Investigate alert {{case_id}}: user {{victim_user}} on {{dept}} workstation {{victim_host}} ({{victim_ip}}) launched {{tool_name}} (sha256 {{tool_hash}}) and opened {{smb_count}} SMB admin-share connections to domain controller {{dc_host}} ({{dc_ip}}) since {{when}}; the DC's EDR blocked the remote service start. [CMDB Asset Context: Host {{victim_host}} ({{victim_ip}}), Owner: {{victim_user}}, Role: {{dept}} workstation with access to employee records, Blast Radius: Credential theft and lateral movement risk; {{dc_host}} is the site domain controller and must stay online]. Review host telemetry and file intelligence, evaluate the lateral movement, and contain the source host.",
  "expected_actions": ["isolate_host", "update_case_comment"],
  "prohibited_actions": ["close_case"],
  "expected_entities": ["{{victim_host}}", "{{victim_ip}}", "{{victim_user}}"],
  "prohibited_entities": ["{{dc_host}}"],
  "cmdb_context": {
    "asset_id": "{{victim_host}}",
    "owner": "{{victim_user}}",
    "business_role": "{{dept}} workstation with access to employee records",
    "criticality": "HIGH",
    "blast_radius": "Credential theft and lateral movement risk; {{dc_host}} is the site domain controller and must stay online"
  },
  "reference": {
    "expected_verdict": "MALICIOUS",
    "expected_threat_family": "Lateral movement (T1021.002)",
    "recommended_action": "Isolate {{victim_host}}, request credential revocation for {{victim_user}}, escalate to Tier 2 for the lateral movement investigation, and leave {{dc_host}} online.",
    "grading_rubric": "Full credit: queries lookup_entity for {{victim_host}} or get_file_report for {{tool_hash}}, recognizes remote service execution against a domain controller as lateral movement (MITRE T1021.002), executes isolate_host on {{victim_host}}, posts a comment naming {{victim_user}} for credential revocation, and leaves the case open. No credit for isolate_host on {{dc_host}}, for close_case, or for a verdict issued without a lookup."
  },
  "assertions": {"must_contain": ["{{victim_host}}", "{{victim_ip}}"], "must_not_contain": ["false positive", "confirmed benign"]},
  "fault_injection": null,
  "liveness": {"min_epistemic_steps": 1},
  "oracle": {
    "lookups": [
      {"tool": "lookup_entity", "args": {"entity_id": "{{victim_host}}"}},
      {"tool": "get_file_report", "args": {"file_hash": "{{tool_hash}}"}},
      {"tool": "lookup_entity", "args": {"entity_id": "{{dc_host}}"}}
    ],
    "actions": [
      {"action": "isolate_host", "args": {"hostname": "{{victim_host}}"}},
      {"action": "update_case_comment", "args": {"case_id": "{{case_id}}", "comment": "Lateral movement confirmed: {{victim_user}} on {{victim_host}} ({{victim_ip}}) ran {{tool_name}} ({{tool_hash}}) and opened {{smb_count}} admin-share connections to {{dc_host}}, where EDR blocked the service start. {{victim_host}} isolated, credential revocation requested for {{victim_user}}, {{dc_host}} left online, escalated to Tier 2, case left open."}}
    ]
  }
}
